{
  "language": "l-lang",
  "version": 4,
  "kind": "module",
  "profile": "module-collection-v1",
  "description": "リバーシのルール・AI・対局状態・履歴・Undo・表示モデルを定義する保存済みSemantic IR。JSONを正本としWasmのみへビルドする。",
  "imports": [],
  "types": [
    {
      "name": "RuleInput",
      "export": true,
      "typeParameters": [],
      "kind": "record",
      "fields": [
        {
          "name": "board",
          "type": {
            "list": "i32"
          }
        },
        {
          "name": "player",
          "type": "i32"
        },
        {
          "name": "action",
          "type": "i32"
        }
      ]
    },
    {
      "name": "RuleOutput",
      "export": true,
      "typeParameters": [],
      "kind": "record",
      "fields": [
        {
          "name": "board",
          "type": {
            "list": "i32"
          }
        },
        {
          "name": "player",
          "type": "i32"
        },
        {
          "name": "legal",
          "type": {
            "list": "i32"
          }
        },
        {
          "name": "over",
          "type": "boolean"
        },
        {
          "name": "winner",
          "type": "i32"
        },
        {
          "name": "black",
          "type": "i32"
        },
        {
          "name": "white",
          "type": "i32"
        },
        {
          "name": "actual",
          "type": "i32"
        },
        {
          "name": "applied",
          "type": "boolean"
        },
        {
          "name": "pass",
          "type": "boolean"
        }
      ]
    },
    {
      "name": "Snapshot",
      "export": true,
      "typeParameters": [],
      "kind": "record",
      "fields": [
        {
          "name": "board",
          "type": {
            "list": "i32"
          }
        },
        {
          "name": "player",
          "type": "i32"
        },
        {
          "name": "last",
          "type": "i32"
        },
        {
          "name": "passed",
          "type": "i32"
        }
      ]
    },
    {
      "name": "State",
      "export": true,
      "typeParameters": [],
      "kind": "record",
      "fields": [
        {
          "name": "board",
          "type": {
            "list": "i32"
          }
        },
        {
          "name": "player",
          "type": "i32"
        },
        {
          "name": "last",
          "type": "i32"
        },
        {
          "name": "passed",
          "type": "i32"
        },
        {
          "name": "history",
          "type": {
            "list": {
              "ref": "Snapshot"
            }
          }
        }
      ]
    },
    {
      "name": "Input",
      "export": true,
      "typeParameters": [],
      "kind": "record",
      "fields": [
        {
          "name": "state",
          "type": {
            "ref": "State"
          }
        },
        {
          "name": "action",
          "type": "i32"
        }
      ]
    },
    {
      "name": "Cell",
      "export": true,
      "typeParameters": [],
      "kind": "record",
      "fields": [
        {
          "name": "stone",
          "type": "i32"
        },
        {
          "name": "enabled",
          "type": "boolean"
        },
        {
          "name": "last",
          "type": "boolean"
        },
        {
          "name": "label",
          "type": "string"
        }
      ]
    },
    {
      "name": "Output",
      "export": true,
      "typeParameters": [],
      "kind": "record",
      "fields": [
        {
          "name": "state",
          "type": {
            "ref": "State"
          }
        },
        {
          "name": "cells",
          "type": {
            "list": {
              "ref": "Cell"
            }
          }
        },
        {
          "name": "black",
          "type": "i32"
        },
        {
          "name": "white",
          "type": "i32"
        },
        {
          "name": "over",
          "type": "boolean"
        },
        {
          "name": "winner",
          "type": "i32"
        },
        {
          "name": "canUndo",
          "type": "boolean"
        },
        {
          "name": "pendingAction",
          "type": "i32"
        },
        {
          "name": "status",
          "type": "string"
        }
      ]
    }
  ],
  "functions": [
    {
      "name": "inside",
      "export": false,
      "typeParameters": [],
      "parameters": [
        {
          "name": "r",
          "type": "i32"
        },
        {
          "name": "c",
          "type": "i32"
        }
      ],
      "returns": "boolean",
      "body": {
        "statements": [
          {
            "kind": "return",
            "value": {
              "kind": "binary",
              "op": "&&",
              "left": {
                "kind": "binary",
                "op": "&&",
                "left": {
                  "kind": "binary",
                  "op": "&&",
                  "left": {
                    "kind": "binary",
                    "op": ">=",
                    "left": {
                      "kind": "param",
                      "name": "r"
                    },
                    "right": {
                      "kind": "literal",
                      "type": "i32",
                      "value": 0
                    }
                  },
                  "right": {
                    "kind": "binary",
                    "op": "<",
                    "left": {
                      "kind": "param",
                      "name": "r"
                    },
                    "right": {
                      "kind": "literal",
                      "type": "i32",
                      "value": 8
                    }
                  }
                },
                "right": {
                  "kind": "binary",
                  "op": ">=",
                  "left": {
                    "kind": "param",
                    "name": "c"
                  },
                  "right": {
                    "kind": "literal",
                    "type": "i32",
                    "value": 0
                  }
                }
              },
              "right": {
                "kind": "binary",
                "op": "<",
                "left": {
                  "kind": "param",
                  "name": "c"
                },
                "right": {
                  "kind": "literal",
                  "type": "i32",
                  "value": 8
                }
              }
            }
          }
        ]
      }
    },
    {
      "name": "legalAt",
      "export": false,
      "typeParameters": [],
      "parameters": [
        {
          "name": "board",
          "type": {
            "list": "i32"
          }
        },
        {
          "name": "player",
          "type": "i32"
        },
        {
          "name": "pos",
          "type": "i32"
        }
      ],
      "returns": "boolean",
      "body": {
        "statements": [
          {
            "kind": "if",
            "condition": {
              "kind": "binary",
              "op": "||",
              "left": {
                "kind": "binary",
                "op": "<",
                "left": {
                  "kind": "param",
                  "name": "pos"
                },
                "right": {
                  "kind": "literal",
                  "type": "i32",
                  "value": 0
                }
              },
              "right": {
                "kind": "binary",
                "op": ">=",
                "left": {
                  "kind": "param",
                  "name": "pos"
                },
                "right": {
                  "kind": "literal",
                  "type": "i32",
                  "value": 64
                }
              }
            },
            "then": [
              {
                "kind": "return",
                "value": {
                  "kind": "literal",
                  "type": "boolean",
                  "value": false
                }
              }
            ],
            "else": []
          },
          {
            "kind": "if",
            "condition": {
              "kind": "binary",
              "op": "!==",
              "left": {
                "kind": "intrinsic",
                "name": "at",
                "typeArguments": [],
                "arguments": [
                  {
                    "kind": "param",
                    "name": "board"
                  },
                  {
                    "kind": "param",
                    "name": "pos"
                  }
                ]
              },
              "right": {
                "kind": "literal",
                "type": "i32",
                "value": 0
              }
            },
            "then": [
              {
                "kind": "return",
                "value": {
                  "kind": "literal",
                  "type": "boolean",
                  "value": false
                }
              }
            ],
            "else": []
          },
          {
            "kind": "const",
            "name": "drs",
            "type": {
              "list": "i32"
            },
            "value": {
              "kind": "list",
              "elementType": "i32",
              "elements": [
                {
                  "kind": "literal",
                  "type": "i32",
                  "value": -1
                },
                {
                  "kind": "literal",
                  "type": "i32",
                  "value": -1
                },
                {
                  "kind": "literal",
                  "type": "i32",
                  "value": -1
                },
                {
                  "kind": "literal",
                  "type": "i32",
                  "value": 0
                },
                {
                  "kind": "literal",